{
  "schema_version": "1.1.0",
  "case_id": "OP3-E04",
  "status": "completed",
  "summary": "Execução em validação com evento de início; conclusão ainda não registrada.",
  "findings": [],
  "open_questions": [],
  "human_next_steps": [
    "Conferir as evidências com o responsável antes de agir."
  ]
}
