{
  "schema_version": "1.1.0",
  "case_id": "OP3-E01",
  "status": "completed",
  "summary": "Execução concluída sem pendências, classificações ou eventos registrados.",
  "findings": [],
  "open_questions": [],
  "human_next_steps": [
    "Conferir as evidências com o responsável antes de agir."
  ]
}
