{
  "schema_version": "1.1.0",
  "case_id": "OP3-E08",
  "status": "insufficient_evidence",
  "summary": "Há classificações incompatíveis para a mesma ordem; não é possível escolher o resultado vigente.",
  "findings": [
    {
      "finding_id": "conflict:4290",
      "title": "Classificações incompatíveis",
      "severity": "warning",
      "statement": "A mesma ordem possui registros de aprovação e retenção.",
      "evidence_ids": [
        "ev-c-4208",
        "ev-c-4209"
      ]
    }
  ],
  "open_questions": [
    "Qual classificação foi revisada e validada pelo responsável?"
  ],
  "human_next_steps": [
    "Conferir as evidências com o responsável antes de agir."
  ]
}
