{
  "schema_version": "1.1.0",
  "case_id": "OP3-E07",
  "status": "completed",
  "summary": "Execução falha com evento de falha e sem pendências registradas.",
  "findings": [
    {
      "finding_id": "event:4207",
      "title": "Evento de falha",
      "severity": "warning",
      "statement": "Há um evento execution_failed associado à execução.",
      "evidence_ids": [
        "ev-e-4207"
      ]
    }
  ],
  "open_questions": [],
  "human_next_steps": [
    "Conferir as evidências com o responsável antes de agir."
  ]
}
